{
  "config": {},
  "description": "e035 smart quotes",
  "lines": {
    "1": [
      "W032"
    ],
    "2": [
      "E035",
      "W001",
      "W011",
      "W012",
      "W030"
    ]
  },
  "must_not": [],
  "rules": [
    "E035",
    "W001",
    "W011",
    "W012",
    "W030",
    "W032"
  ],
  "tags": [
    "syntax"
  ]
}
