{
  "config": {},
  "description": "sec016 restart no limit",
  "lines": {
    "2": [
      "S018",
      "S027",
      "SEC016"
    ],
    "3": [
      "SEC005"
    ],
    "4": [
      "SEC016",
      "W001"
    ]
  },
  "must_not": [
    "S010"
  ],
  "rules": [
    "S018",
    "S027",
    "SEC005",
    "SEC016",
    "W001"
  ],
  "tags": [
    "integration"
  ]
}
