{
  "config": {},
  "description": "sec024 self copy removable",
  "lines": {
    "2": [
      "SEC006",
      "SEC024",
      "W001",
      "W002",
      "W025"
    ]
  },
  "must_not": [],
  "rules": [
    "SEC006",
    "SEC024",
    "W001",
    "W002",
    "W025"
  ],
  "tags": [
    "integration"
  ]
}
