{
  "config": {},
  "description": "p002 code duplication",
  "lines": {
    "2": [
      "E006",
      "W002",
      "W003"
    ],
    "3": [
      "E006",
      "P002",
      "W002",
      "W003"
    ],
    "4": [
      "E006",
      "P002",
      "W002",
      "W003"
    ],
    "5": [
      "E006",
      "P002",
      "W001",
      "W002",
      "W003"
    ]
  },
  "must_not": [],
  "rules": [
    "E006",
    "P002",
    "W001",
    "W002",
    "W003"
  ],
  "tags": [
    "integration"
  ]
}
