{
  "config": {},
  "description": "Hyphenated filenames like set-permissions.bat are batch, not PowerShell",
  "lines": {
    "2": [
      "E006",
      "SEC006",
      "W005"
    ]
  },
  "must_not": [],
  "rules": [
    "E006",
    "SEC006",
    "W005"
  ],
  "tags": [
    "integration"
  ]
}
