{
  "config": {},
  "description": "Embedded VBScript after a label is skipped; Dim/CreateObject are not batch commands",
  "lines": {
    "4": [
      "S010",
      "S018"
    ],
    "10": [
      "S018"
    ]
  },
  "must_not": [
    "E012",
    "E013"
  ],
  "rules": [
    "S010",
    "S018"
  ],
  "tags": [
    "integration"
  ]
}
