{
  "config": {},
  "description": "s015 inconsistent goto colon",
  "lines": {
    "3": [
      "E008",
      "S015",
      "W001"
    ],
    "4": [
      "S018",
      "S027"
    ],
    "5": [
      "S018",
      "S027"
    ]
  },
  "must_not": [
    "W004"
  ],
  "rules": [
    "E008",
    "S015",
    "S018",
    "S027",
    "W001"
  ],
  "tags": [
    "integration"
  ]
}
