{
  "config": {},
  "description": "p027 setlocal nesting",
  "lines": {
    "1": [
      "E018",
      "S013"
    ],
    "10": [
      "P003"
    ],
    "11": [
      "P003"
    ],
    "12": [
      "P003"
    ],
    "13": [
      "P003"
    ],
    "14": [
      "P003"
    ],
    "15": [
      "P003"
    ],
    "16": [
      "P003"
    ],
    "17": [
      "P003"
    ],
    "18": [
      "P003"
    ],
    "19": [
      "P003"
    ],
    "2": [
      "P003"
    ],
    "20": [
      "P003"
    ],
    "21": [
      "P003"
    ],
    "22": [
      "P003"
    ],
    "23": [
      "P003"
    ],
    "24": [
      "P003"
    ],
    "25": [
      "P003"
    ],
    "26": [
      "P003"
    ],
    "27": [
      "P003"
    ],
    "28": [
      "P003"
    ],
    "29": [
      "P003"
    ],
    "3": [
      "P003",
      "P024"
    ],
    "30": [
      "P003"
    ],
    "31": [
      "P003"
    ],
    "32": [
      "P003"
    ],
    "33": [
      "P003"
    ],
    "34": [
      "P003",
      "P027"
    ],
    "4": [
      "P003"
    ],
    "5": [
      "P003"
    ],
    "6": [
      "P003"
    ],
    "7": [
      "P003"
    ],
    "8": [
      "P003"
    ],
    "9": [
      "P003"
    ]
  },
  "must_not": [],
  "rules": [
    "E018",
    "P003",
    "P024",
    "P027",
    "S013"
  ],
  "tags": [
    "integration"
  ]
}
