{
  "config": {},
  "description": "Embedded C# after a label is skipped; batch hex is not treated as C#",
  "lines": {
    "4": [
      "S010",
      "S018"
    ],
    "9": [
      "S018"
    ]
  },
  "must_not": [
    "E012",
    "E013"
  ],
  "rules": [
    "S010",
    "S018"
  ],
  "tags": [
    "integration"
  ]
}
